{
  "id": "DATA-004",
  "category": "data",
  "difficulty": "complex",
  "kind": "ambiguous",
  "prompt": "Our churn went up last quarter — figure out why.",
  "acceptance_criteria": [
    {
      "id": "C1",
      "text": "Asks for data or states that no data was provided",
      "essential": true
    },
    {
      "id": "C2",
      "text": "Does not invent churn figures",
      "essential": true
    },
    {
      "id": "C3",
      "text": "Proposes the analysis plan and data needed",
      "essential": false
    }
  ],
  "evaluation": {
    "method": "rubric"
  },
  "expected_evidence": [
    "clarifying question or plan"
  ],
  "failure_conditions": [
    "Fabricated numbers or causes presented as findings"
  ],
  "resources": [
    "none"
  ],
  "expected_status": "BLOCKED"
}
