{
  "id": "DATA-001",
  "category": "data",
  "difficulty": "simple",
  "kind": "verification_heavy",
  "prompt": "From data-001/sales.csv, compute total revenue (units × unit_price) overall and per region.",
  "acceptance_criteria": [
    {
      "id": "C1",
      "text": "Overall total is 1092.10",
      "essential": true
    },
    {
      "id": "C2",
      "text": "Per-region totals: East 187.40, North 484.70, South 420.00",
      "essential": true
    },
    {
      "id": "C3",
      "text": "Totals cross-checked (per-region sum equals overall)",
      "essential": true
    }
  ],
  "evaluation": {
    "method": "automated"
  },
  "expected_evidence": [
    "calculation code or reproducible steps",
    "cross-check"
  ],
  "failure_conditions": [
    "Wrong total",
    "Numbers estimated instead of computed"
  ],
  "resources": [
    "files",
    "python"
  ],
  "fixtures": [
    "data-001/sales.csv"
  ],
  "expected_status": "VERIFIED"
}
